{
  "schema_version": "measure-testify/receipt/v1",
  "status": "CLEAN",
  "generated_at_utc": "2026-07-28T18:20:09Z",
  "query": {
    "address": "Ontario Legislative Building, 111 Wellesley Street West, Toronto, ON, Canada",
    "lat": null,
    "lon": null,
    "feature": "parcel",
    "radius_m": 60.0,
    "calibrators": [
      "basemap"
    ],
    "vertices_path": null,
    "scale_segment": null,
    "scale_length_ft": null,
    "parcel_layer": "ontario_demo"
  },
  "geocode": {
    "lat": 43.6626213,
    "lon": -79.3910161,
    "display_name": "Ontario Legislative Building, 111, Wellesley Street West, Bay-Cloverhill, Downtown, Toronto, Golden Horseshoe, Ontario, M7A 1A2, Canada",
    "source": "nominatim.openstreetmap.org",
    "osm_type": "way",
    "osm_id": 15089986
  },
  "scale_chain": [
    {
      "id": "basemap_local_en",
      "kind": "basemap",
      "meters_per_unit": 1.0,
      "uncertainty_pct": 2.0,
      "notes": "Local equirectangular EN at lat=43.66262; valid for footprints within ~200m of pin. Not a cadastral survey."
    }
  ],
  "candidates": [
    {
      "id": "way/15089986",
      "source": "Bing",
      "footprint_m2": 8861.59,
      "footprint_sqft": 95385.3,
      "dist_m_from_pin": 54.71,
      "offset_E_m": -54.7,
      "offset_N_m": 1.04,
      "bbox_ft": {
        "width": 494.3,
        "height": 424.1
      },
      "edge_lengths_ft": [
        4.5,
        4.9,
        4.9,
        4.9,
        4.9,
        4.9,
        4.9,
        4.9,
        4.9,
        25.4,
        26.4,
        25.0,
        19.1,
        8.2,
        8.8,
        65.8,
        6.9,
        51.9,
        9.4,
        20.0,
        5.5,
        17.5,
        7.5,
        7.3,
        22.0,
        7.6,
        7.4,
        17.4,
        5.7,
        9.8,
        76.2,
        52.5,
        22.2,
        21.4,
        22.7,
        70.4,
        3.9,
        2.6,
        3.1,
        3.2,
        43.3,
        5.0,
        10.0,
        12.3,
        9.5,
        7.7,
        11.4,
        1.4,
        2.9,
        3.3,
        4.1,
        11.0,
        9.7,
        7.7,
        8.3,
        9.7,
        11.2,
        4.1,
        2.4,
        2.7,
        2.5,
        10.7,
        8.3,
        9.7,
        14.1,
        8.5,
        4.4,
        39.5,
        3.5,
        4.3,
        3.6,
        3.5,
        19.8,
        57.6,
        40.7,
        55.1,
        58.6,
        14.1,
        4.9,
        9.2,
        4.9,
        17.0,
        7.3,
        7.1,
        23.7,
        7.1,
        7.8,
        16.5,
        5.1,
        21.1,
        8.8,
        50.7,
        9.9,
        63.6,
        9.9,
        29.0,
        3.7,
        46.2,
        9.7,
        15.4,
        5.1,
        5.1,
        5.1,
        5.1,
        5.1,
        5.1,
        5.1,
        5.1,
        5.1,
        16.8,
        10.5,
        51.0,
        85.3,
        12.1,
        33.8,
        2.5,
        3.7,
        3.7,
        3.7,
        3.7,
        3.7,
        4.7,
        13.1,
        72.5,
        43.3,
        29.6,
        8.9,
        18.5,
        2.9,
        5.5,
        4.9,
        5.3,
        4.3,
        3.9,
        4.1,
        4.1,
        3.3,
        3.6,
        5.0,
        4.7,
        5.8,
        5.8,
        7.3,
        2.9,
        17.1,
        3.2,
        29.6,
        3.2,
        8.6,
        5.6,
        32.0,
        5.4,
        10.1,
        11.3,
        12.7,
        8.7,
        5.3,
        31.7,
        5.4,
        5.3,
        34.0,
        3.1,
        19.2,
        2.8,
        3.9,
        6.7,
        3.4,
        3.5,
        4.4,
        4.9,
        4.3,
        4.2,
        3.9,
        3.6,
        3.7,
        3.8,
        5.3,
        6.7,
        3.4,
        2.2,
        19.5,
        8.7,
        32.1,
        37.7,
        71.0,
        14.2,
        5.5,
        3.3,
        3.8,
        3.0,
        3.4,
        3.1,
        4.2,
        32.8,
        3.4,
        9.0,
        66.8,
        6.8,
        20.0,
        44.3,
        8.6,
        19.7
      ],
      "gla_band_sqft": {
        "low": 81077.5,
        "high": 90616.1,
        "factor_low": 0.85,
        "factor_high": 0.95
      },
      "polygon_sha256": "77034d9e03f8eff1922c994d41fc5baec64e9b6705b324286b89cbedd099cbde",
      "linear_scale_factor": 1.0,
      "osm_url": "https://www.openstreetmap.org/way/15089986",
      "coords_latlon": [
        [
          43.6628392,
          -79.3912517
        ],
        [
          43.6628382,
          -79.3912685
        ],
        [
          43.6628412,
          -79.3912865
        ],
        [
          43.6628484,
          -79.3913021
        ],
        [
          43.662859,
          -79.3913133
        ],
        [
          43.6628717,
          -79.391319
        ],
        [
          43.6628851,
          -79.3913184
        ],
        [
          43.6628975,
          -79.3913116
        ],
        [
          43.6629075,
          -79.3912994
        ],
        [
          43.6629141,
          -79.3912834
        ],
        [
          43.662981,
          -79.39131
        ],
        [
          43.6630026,
          -79.3912147
        ],
        [
          43.6630228,
          -79.3911244
        ],
        [
          43.6630384,
          -79.3910554
        ],
        [
          43.663017,
          -79.3910457
        ],
        [
          43.6630236,
          -79.3910137
        ],
        [
          43.6628515,
          -79.3909402
        ],
        [
          43.6628461,
          -79.3909654
        ],
        [
          43.6627103,
          -79.390908
        ],
        [
          43.662718,
          -79.3908739
        ],
        [
          43.6626657,
          -79.3908514
        ],
        [
          43.6626703,
          -79.3908315
        ],
        [
          43.6626845,
          -79.3907681
        ],
        [
          43.6626906,
          -79.390741
        ],
        [
          43.6626716,
          -79.3907328
        ],
        [
          43.6626142,
          -79.3907081
        ],
        [
          43.6625944,
          -79.3906995
        ],
        [
          43.6625884,
          -79.3907261
        ],
        [
          43.6625742,
          -79.3907889
        ],
        [
          43.6625697,
          -79.3908095
        ],
        [
          43.6625623,
          -79.390845
        ],
        [
          43.6623627,
          -79.3907613
        ],
        [
          43.6623203,
          -79.3909512
        ],
        [
          43.6623785,
          -79.390975
        ],
        [
          43.6623607,
          -79.3910521
        ],
        [
          43.66242,
          -79.391078
        ],
        [
          43.6623662,
          -79.391334
        ],
        [
          43.6623554,
          -79.3913341
        ],
        [
          43.6623487,
          -79.3913378
        ],
        [
          43.6623425,
          -79.3913458
        ],
        [
          43.6623385,
          -79.3913567
        ],
        [
          43.6622247,
          -79.3913106
        ],
        [
          43.6622284,
          -79.3912925
        ],
        [
          43.6622023,
          -79.3912814
        ],
        [
          43.6621701,
          -79.3912676
        ],
        [
          43.6621453,
          -79.3912572
        ],
        [
          43.6621393,
          -79.3912851
        ],
        [
          43.6621309,
          -79.3913268
        ],
        [
          43.6621298,
          -79.3913319
        ],
        [
          43.6621279,
          -79.3913426
        ],
        [
          43.6621253,
          -79.3913544
        ],
        [
          43.6621219,
          -79.3913692
        ],
        [
          43.662113,
          -79.3914089
        ],
        [
          43.6621049,
          -79.391444
        ],
        [
          43.6620988,
          -79.3914717
        ],
        [
          43.6620924,
          -79.3915017
        ],
        [
          43.6620846,
          -79.3915368
        ],
        [
          43.6620757,
          -79.3915774
        ],
        [
          43.6620723,
          -79.3915921
        ],
        [
          43.6620702,
          -79.3916007
        ],
        [
          43.662068,
          -79.3916104
        ],
        [
          43.662066,
          -79.3916195
        ],
        [
          43.6620575,
          -79.3916584
        ],
        [
          43.6620507,
          -79.3916882
        ],
        [
          43.6620762,
          -79.3916991
        ],
        [
          43.662113,
          -79.3917156
        ],
        [
          43.6621351,
          -79.3917252
        ],
        [
          43.6621388,
          -79.3917094
        ],
        [
          43.662242,
          -79.3917542
        ],
        [
          43.6622397,
          -79.3917669
        ],
        [
          43.6622408,
          -79.3917832
        ],
        [
          43.6622465,
          -79.3917942
        ],
        [
          43.6622548,
          -79.3918005
        ],
        [
          43.6622387,
          -79.391872
        ],
        [
          43.6621918,
          -79.3920802
        ],
        [
          43.6620853,
          -79.3920352
        ],
        [
          43.6620408,
          -79.3922344
        ],
        [
          43.6621944,
          -79.3922984
        ],
        [
          43.6622311,
          -79.3923148
        ],
        [
          43.6622271,
          -79.3923326
        ],
        [
          43.66222,
          -79.3923661
        ],
        [
          43.6622163,
          -79.392384
        ],
        [
          43.6622041,
          -79.392446
        ],
        [
          43.6621983,
          -79.3924723
        ],
        [
          43.6622168,
          -79.3924803
        ],
        [
          43.6622789,